{
  "schema_version": 1,
  "color": {
    "background": "#F6F0E5",
    "surface": "#E6DDCD",
    "text": "#233F62",
    "muted": "#4E5968",
    "accent": "#A43828",
    "on_accent": "#FFFFFF",
    "border": "#6E7480",
    "focus": "#233F62",
    "red": "#C54935",
    "wood_light": "#E5BD87",
    "wood": "#B17B49",
    "wood_dark": "#71452D",
    "wood_rose": "#AE6750"
  },
  "typography": {
    "display": {
      "family": "Arial",
      "fallback_stack": [
        "Helvetica",
        "sans-serif"
      ],
      "source": "system"
    },
    "body": {
      "family": "Arial",
      "fallback_stack": [
        "Helvetica",
        "sans-serif"
      ],
      "source": "system"
    },
    "size": {
      "small": "0.875rem",
      "body": "1rem",
      "heading": "3rem",
      "display": "6rem"
    },
    "weight": {
      "regular": 400,
      "bold": 700,
      "display": 700
    },
    "line_height": {
      "body": 1.6,
      "heading": 1.1
    },
    "letter_spacing": {
      "body": "0em",
      "heading": "-0.045em"
    },
    "language_test": "\u0104\u010c\u0118\u0116\u012e\u0160\u0172\u016a\u017d \u0105\u010d\u0119\u0117\u012f\u0161\u0173\u016b\u017e"
  },
  "spacing": {
    "small": "0.5rem",
    "medium": "1rem",
    "large": "2rem",
    "section": "4rem"
  },
  "radius": {
    "none": "0",
    "small": "0.25rem"
  },
  "shadow": {
    "none": "none"
  },
  "motion": {
    "duration": {
      "instant": 0,
      "short": 150,
      "intro": 1000,
      "shape": 700,
      "sample": 750
    },
    "easing": {
      "standard": "ease-out"
    },
    "reduced_motion": "Remove nonessential transforms and transitions; keep all content visible."
  },
  "layout": {
    "content_max_width": "88rem",
    "text_max_width": "65ch",
    "breakpoints": {
      "tablet": 768,
      "desktop": 1024
    }
  },
  "contrast_pairs": [
    {
      "foreground": "text",
      "background": "background",
      "purpose": "Body text",
      "minimum_ratio": 4.5
    },
    {
      "foreground": "muted",
      "background": "surface",
      "purpose": "Secondary text",
      "minimum_ratio": 4.5
    },
    {
      "foreground": "on_accent",
      "background": "accent",
      "purpose": "Action labels",
      "minimum_ratio": 4.5
    },
    {
      "foreground": "focus",
      "background": "background",
      "purpose": "Focus outline",
      "minimum_ratio": 3
    }
  ]
}
