{
  "schema_version": 1,
  "color": {
    "background": "#F5F3E9",
    "surface": "#E9C547",
    "text": "#181C22",
    "muted": "#3F4649",
    "accent": "#2445C6",
    "on_accent": "#F5F3E9",
    "border": "#71766D",
    "focus": "#2445C6"
  },
  "typography": {
    "display": {
      "family": "Arial",
      "fallback_stack": [
        "Helvetica",
        "sans-serif"
      ],
      "source": "system"
    },
    "body": {
      "family": "Arial",
      "fallback_stack": [
        "Helvetica",
        "sans-serif"
      ],
      "source": "system"
    },
    "size": {
      "small": "0.875rem",
      "body": "1rem",
      "heading": "2rem",
      "display": "4rem"
    },
    "weight": {
      "regular": 400,
      "bold": 700
    },
    "line_height": {
      "body": 1.6,
      "heading": 1.1
    },
    "letter_spacing": {
      "body": "0em",
      "heading": "-0.02em"
    },
    "language_test": "ĄČĘĖĮŠŲŪŽ ąčęėįšųūž"
  },
  "spacing": {
    "small": "0.5rem",
    "medium": "1rem",
    "large": "2rem",
    "section": "4rem"
  },
  "radius": {
    "none": "0",
    "small": "0.25rem"
  },
  "shadow": {
    "none": "none"
  },
  "motion": {
    "duration": {
      "instant": 0,
      "short": 150,
      "scene": 700,
      "detail": 350,
      "drop": 400
    },
    "easing": {
      "standard": "ease-out"
    },
    "reduced_motion": "Remove nonessential transforms and transitions; keep all content visible."
  },
  "layout": {
    "content_max_width": "75rem",
    "text_max_width": "65ch",
    "breakpoints": {
      "tablet": 768,
      "desktop": 1024
    }
  },
  "contrast_pairs": [
    {
      "foreground": "text",
      "background": "background",
      "purpose": "Body text",
      "minimum_ratio": 4.5
    },
    {
      "foreground": "muted",
      "background": "surface",
      "purpose": "Secondary text",
      "minimum_ratio": 4.5
    },
    {
      "foreground": "on_accent",
      "background": "accent",
      "purpose": "Action labels",
      "minimum_ratio": 4.5
    },
    {
      "foreground": "focus",
      "background": "background",
      "purpose": "Focus outline",
      "minimum_ratio": 3
    }
  ]
}
