{
  "schema_version": 1,
  "color": {
    "background": "#120d0a",
    "surface": "#211711",
    "text": "#f4eada",
    "muted": "#c9b49c",
    "accent": "#e9ba78",
    "on_accent": "#211711",
    "border": "#98826c",
    "focus": "#ffdb9e",
    "paper": "#f2e8d9",
    "ink": "#32261b",
    "paper_muted": "#68523f",
    "paper_border": "#8b735d",
    "error": "#922c26",
    "glow": "#b96b2a"
  },
  "typography": {
    "display": {
      "family": "Newsreader",
      "fallback_stack": [
        "serif"
      ],
      "source": "local",
      "file": "assets/fonts/newsreader/Newsreader-Regular-LT.woff2",
      "asset_id": "newsreader"
    },
    "body": {
      "family": "Jost",
      "fallback_stack": [
        "sans-serif"
      ],
      "source": "local",
      "file": "assets/fonts/jost/Jost-Regular-LT.woff2",
      "asset_id": "jost"
    },
    "size": {
      "small": "0.75rem",
      "body": "1.0625rem",
      "heading": "3rem",
      "display": "4.75rem"
    },
    "weight": {
      "regular": 400,
      "bold": 400
    },
    "line_height": {
      "body": 1.6,
      "heading": 1.05
    },
    "letter_spacing": {
      "body": "0em",
      "heading": "-0.025em"
    },
    "language_test": "ĄČĘĖĮŠŲŪŽ ąčęėįšųūž"
  },
  "spacing": {
    "small": "0.5rem",
    "medium": "1rem",
    "large": "2.5rem",
    "section": "8rem"
  },
  "radius": {
    "none": "0",
    "pill": "999px"
  },
  "shadow": {
    "none": "none"
  },
  "motion": {
    "duration": {
      "instant": 0,
      "short": 220,
      "light": 1500
    },
    "easing": {
      "standard": "cubic-bezier(0.2, 0.7, 0.2, 1)"
    },
    "reduced_motion": "Show the final candlelit photographs immediately; course, room and booking choices update without transitions or RAF. All ten courses and the complete service remain available."
  },
  "layout": {
    "content_max_width": "84rem",
    "text_max_width": "34ch",
    "breakpoints": {
      "tablet": 768,
      "desktop": 1024
    }
  },
  "contrast_pairs": [
    {
      "foreground": "text",
      "background": "background",
      "purpose": "text on background",
      "minimum_ratio": 4.5
    },
    {
      "foreground": "muted",
      "background": "background",
      "purpose": "muted on background",
      "minimum_ratio": 4.5
    },
    {
      "foreground": "text",
      "background": "surface",
      "purpose": "text on surface",
      "minimum_ratio": 4.5
    },
    {
      "foreground": "muted",
      "background": "surface",
      "purpose": "muted on surface",
      "minimum_ratio": 4.5
    },
    {
      "foreground": "accent",
      "background": "background",
      "purpose": "accent on background",
      "minimum_ratio": 4.5
    },
    {
      "foreground": "accent",
      "background": "surface",
      "purpose": "accent on surface",
      "minimum_ratio": 4.5
    },
    {
      "foreground": "on_accent",
      "background": "accent",
      "purpose": "on_accent on accent",
      "minimum_ratio": 4.5
    },
    {
      "foreground": "ink",
      "background": "paper",
      "purpose": "ink on paper",
      "minimum_ratio": 4.5
    },
    {
      "foreground": "paper_muted",
      "background": "paper",
      "purpose": "paper_muted on paper",
      "minimum_ratio": 4.5
    },
    {
      "foreground": "error",
      "background": "paper",
      "purpose": "error on paper",
      "minimum_ratio": 4.5
    },
    {
      "foreground": "border",
      "background": "background",
      "purpose": "border on background",
      "minimum_ratio": 3
    },
    {
      "foreground": "border",
      "background": "surface",
      "purpose": "border on surface",
      "minimum_ratio": 3
    },
    {
      "foreground": "paper_border",
      "background": "paper",
      "purpose": "paper_border on paper",
      "minimum_ratio": 3
    },
    {
      "foreground": "focus",
      "background": "background",
      "purpose": "focus on background",
      "minimum_ratio": 3
    },
    {
      "foreground": "ink",
      "background": "paper",
      "purpose": "ink on paper",
      "minimum_ratio": 3
    }
  ]
}
