{
  "schema_version": 1,
  "color": {
    "background": "#fcfaf6",
    "surface": "#f0ebe0",
    "text": "#10294a",
    "muted": "#485b6c",
    "accent": "#77603b",
    "on_accent": "#fffdf8",
    "border": "#787d80",
    "focus": "#1b6580",
    "sea": "#bfd1d5",
    "sea_dark": "#426b7c",
    "white": "#ffffff",
    "hull": "#eff0e8",
    "window": "#193c53",
    "teak": "#c6ac80",
    "line": "#6f8190",
    "error": "#9c312b"
  },
  "typography": {
    "display": {
      "family": "Crimson Pro",
      "fallback_stack": [
        "serif"
      ],
      "source": "local",
      "file": "assets/fonts/crimson/CrimsonPro-Light-LT.woff2",
      "asset_id": "crimson-pro-light"
    },
    "body": {
      "family": "Jost",
      "fallback_stack": [
        "sans-serif"
      ],
      "source": "local",
      "file": "assets/fonts/jost/Jost-Regular-LT.woff2",
      "asset_id": "jost-regular"
    },
    "size": {
      "small": "0.75rem",
      "body": "1.125rem",
      "heading": "3rem",
      "display": "4rem"
    },
    "weight": {
      "regular": 400,
      "bold": 300
    },
    "line_height": {
      "body": 1.6,
      "heading": 1.04
    },
    "letter_spacing": {
      "body": "0em",
      "heading": "0em"
    },
    "language_test": "ĄČĘĖĮŠŲŪŽ ąčęėįšųūž"
  },
  "spacing": {
    "small": "0.5rem",
    "medium": "1rem",
    "large": "2.5rem",
    "section": "7rem"
  },
  "radius": {
    "none": "0",
    "pill": "999px"
  },
  "shadow": {
    "none": "none"
  },
  "motion": {
    "duration": {
      "instant": 0,
      "short": 180
    },
    "easing": {
      "standard": "cubic-bezier(0.22, 0.61, 0.36, 1)"
    },
    "reduced_motion": "Show the completed yacht wake and route immediately. All zone, route and form controls remain instantaneous."
  },
  "layout": {
    "content_max_width": "82rem",
    "text_max_width": "36ch",
    "breakpoints": {
      "tablet": 768,
      "desktop": 1024
    }
  },
  "contrast_pairs": [
    {
      "foreground": "text",
      "background": "background",
      "purpose": "text on background",
      "minimum_ratio": 4.5
    },
    {
      "foreground": "muted",
      "background": "background",
      "purpose": "muted on background",
      "minimum_ratio": 4.5
    },
    {
      "foreground": "text",
      "background": "surface",
      "purpose": "text on surface",
      "minimum_ratio": 4.5
    },
    {
      "foreground": "muted",
      "background": "surface",
      "purpose": "muted on surface",
      "minimum_ratio": 4.5
    },
    {
      "foreground": "accent",
      "background": "background",
      "purpose": "accent on background",
      "minimum_ratio": 4.5
    },
    {
      "foreground": "on_accent",
      "background": "text",
      "purpose": "on_accent on text",
      "minimum_ratio": 4.5
    },
    {
      "foreground": "text",
      "background": "sea",
      "purpose": "text on sea",
      "minimum_ratio": 4.5
    },
    {
      "foreground": "border",
      "background": "background",
      "purpose": "border on background",
      "minimum_ratio": 3
    },
    {
      "foreground": "border",
      "background": "surface",
      "purpose": "border on surface",
      "minimum_ratio": 3
    },
    {
      "foreground": "focus",
      "background": "background",
      "purpose": "focus on background",
      "minimum_ratio": 3
    },
    {
      "foreground": "error",
      "background": "background",
      "purpose": "error on background",
      "minimum_ratio": 4.5
    }
  ]
}
