{
  "schema_version": 1,
  "color": {
    "background": "#000000",
    "surface": "#1d1d1f",
    "text": "#f5f5f7",
    "muted": "#b7b9c0",
    "accent": "#a5d8f6",
    "on_accent": "#102331",
    "border": "#777b83",
    "focus": "#a5d8f6",
    "paper": "#f5f5f7",
    "ink": "#1d1d1f",
    "paper_muted": "#535862",
    "paper_border": "#767b84",
    "paper_focus": "#215470"
  },
  "typography": {
    "display": {
      "family": "Manrope",
      "fallback_stack": [
        "sans-serif"
      ],
      "source": "local",
      "file": "assets/fonts/Manrope-Latin-LT.woff2",
      "asset_id": "manrope-latin-lt"
    },
    "body": {
      "family": "Manrope",
      "fallback_stack": [
        "sans-serif"
      ],
      "source": "local",
      "file": "assets/fonts/Manrope-Latin-LT.woff2",
      "asset_id": "manrope-latin-lt"
    },
    "size": {
      "small": "0.8125rem",
      "body": "1.0625rem",
      "heading": "3rem",
      "display": "5rem"
    },
    "weight": {
      "regular": 400,
      "bold": 600
    },
    "line_height": {
      "body": 1.6,
      "heading": 1.1
    },
    "letter_spacing": {
      "body": "0em",
      "heading": "-0.02em"
    },
    "language_test": "ĄČĘĖĮŠŲŪŽ ąčęėįšųūž"
  },
  "spacing": {
    "small": "0.5rem",
    "medium": "1rem",
    "large": "2rem",
    "section": "7rem"
  },
  "radius": {
    "none": "0",
    "small": "0.25rem"
  },
  "shadow": {
    "none": "none"
  },
  "motion": {
    "duration": {
      "instant": 0,
      "short": 150
    },
    "easing": {
      "standard": "ease-out"
    },
    "reduced_motion": "Remove nonessential transforms and transitions; keep all content visible."
  },
  "layout": {
    "content_max_width": "84rem",
    "text_max_width": "34ch",
    "breakpoints": {
      "tablet": 768,
      "desktop": 1024
    }
  },
  "contrast_pairs": [
    {
      "foreground": "text",
      "background": "background",
      "purpose": "Primary text",
      "minimum_ratio": 4.5
    },
    {
      "foreground": "muted",
      "background": "background",
      "purpose": "Dark captions",
      "minimum_ratio": 4.5
    },
    {
      "foreground": "text",
      "background": "surface",
      "purpose": "Graphite scene text",
      "minimum_ratio": 4.5
    },
    {
      "foreground": "muted",
      "background": "surface",
      "purpose": "Graphite captions",
      "minimum_ratio": 4.5
    },
    {
      "foreground": "on_accent",
      "background": "accent",
      "purpose": "Primary action",
      "minimum_ratio": 4.5
    },
    {
      "foreground": "focus",
      "background": "background",
      "purpose": "Dark focus",
      "minimum_ratio": 3
    },
    {
      "foreground": "ink",
      "background": "paper",
      "purpose": "Selection text",
      "minimum_ratio": 4.5
    },
    {
      "foreground": "paper_muted",
      "background": "paper",
      "purpose": "Selection captions",
      "minimum_ratio": 4.5
    },
    {
      "foreground": "paper_border",
      "background": "paper",
      "purpose": "Control boundaries",
      "minimum_ratio": 3
    },
    {
      "foreground": "paper_focus",
      "background": "paper",
      "purpose": "Selection focus",
      "minimum_ratio": 3
    }
  ]
}
