{
  "schema_version": 1,
  "color": {
    "background": "#1c1c1c",
    "surface": "#272725",
    "text": "#f4efe5",
    "muted": "#c6c0b5",
    "accent": "#d5c6aa",
    "on_accent": "#1c1c1c",
    "border": "#8c877e",
    "focus": "#ebd5a8",
    "paper": "#f4efe5",
    "ink": "#262622",
    "paper_muted": "#59594f",
    "error": "#a32927",
    "timer": "#ffaaa1",
    "light": "#fff0d0"
  },
  "typography": {
    "display": {
      "family": "Bodoni Moda",
      "fallback_stack": [
        "serif"
      ],
      "source": "local",
      "file": "assets/fonts/bodoni/BodoniModa-Display-LT.woff2",
      "asset_id": "bodoni"
    },
    "body": {
      "family": "Patina Mono",
      "fallback_stack": [
        "monospace"
      ],
      "source": "local",
      "file": "assets/fonts/plex/IBMPlexMono-Regular-LT.woff2",
      "asset_id": "plex"
    },
    "size": {
      "small": "0.75rem",
      "body": "1rem",
      "heading": "2.5rem",
      "display": "3.5rem"
    },
    "weight": {
      "regular": 400,
      "bold": 400
    },
    "line_height": {
      "body": 1.65,
      "heading": 1.08
    },
    "letter_spacing": {
      "body": "0em",
      "heading": "-0.02em"
    },
    "language_test": "ĄČĘĖĮŠŲŪŽ ąčęėįšųūž"
  },
  "spacing": {
    "small": "0.5rem",
    "medium": "1rem",
    "large": "2.5rem",
    "section": "8rem"
  },
  "radius": {
    "none": "0",
    "pill": "999px"
  },
  "shadow": {
    "none": "none"
  },
  "motion": {
    "duration": {
      "instant": 0,
      "short": 200,
      "drawer": 420
    },
    "easing": {
      "standard": "cubic-bezier(0.2, 0.7, 0.2, 1)"
    },
    "reduced_motion": "Final spotlight immediately; manual controls remain available with no animation."
  },
  "layout": {
    "content_max_width": "84rem",
    "text_max_width": "38ch",
    "breakpoints": {
      "tablet": 768,
      "desktop": 1024
    }
  },
  "contrast_pairs": [
    {
      "foreground": "text",
      "background": "background",
      "purpose": "text on background",
      "minimum_ratio": 4.5
    },
    {
      "foreground": "muted",
      "background": "surface",
      "purpose": "muted on surface",
      "minimum_ratio": 4.5
    },
    {
      "foreground": "accent",
      "background": "surface",
      "purpose": "accent on surface",
      "minimum_ratio": 4.5
    },
    {
      "foreground": "timer",
      "background": "background",
      "purpose": "timer on background",
      "minimum_ratio": 4.5
    },
    {
      "foreground": "ink",
      "background": "paper",
      "purpose": "ink on paper",
      "minimum_ratio": 4.5
    },
    {
      "foreground": "paper_muted",
      "background": "paper",
      "purpose": "paper_muted on paper",
      "minimum_ratio": 4.5
    },
    {
      "foreground": "error",
      "background": "paper",
      "purpose": "error on paper",
      "minimum_ratio": 4.5
    },
    {
      "foreground": "border",
      "background": "background",
      "purpose": "border on background",
      "minimum_ratio": 3
    },
    {
      "foreground": "border",
      "background": "paper",
      "purpose": "border on paper",
      "minimum_ratio": 3
    },
    {
      "foreground": "focus",
      "background": "background",
      "purpose": "focus on background",
      "minimum_ratio": 3
    }
  ]
}
