{
  "schema_version": 1,
  "color": {
    "background": "#0b0b0c",
    "surface": "#19191b",
    "text": "#f0e9dc",
    "muted": "#b3ada2",
    "accent": "#c4a477",
    "on_accent": "#0b0b0c",
    "border": "#797268",
    "focus": "#f5c784"
  },
  "typography": {
    "display": {
      "family": "Cormorant Garamond",
      "fallback_stack": [
        "serif"
      ],
      "source": "local",
      "file": "assets/fonts/cormorant/CormorantGaramond-Light-LT.woff2",
      "asset_id": "cormorant-garamond-light"
    },
    "body": {
      "family": "Jost",
      "fallback_stack": [
        "sans-serif"
      ],
      "source": "local",
      "file": "assets/fonts/jost/Jost-Regular-LT.woff2",
      "asset_id": "jost-regular"
    },
    "size": {
      "small": "0.75rem",
      "body": "1.125rem",
      "heading": "3rem",
      "display": "4rem"
    },
    "weight": {
      "regular": 400,
      "bold": 300
    },
    "line_height": {
      "body": 1.6,
      "heading": 1.04
    },
    "letter_spacing": {
      "body": "0em",
      "heading": "0em"
    },
    "language_test": "ĄČĘĖĮŠŲŪŽ ąčęėįšųūž"
  },
  "spacing": {
    "small": "0.5rem",
    "medium": "1rem",
    "large": "2.5rem",
    "section": "7rem"
  },
  "radius": {
    "none": "0",
    "pill": "999px"
  },
  "shadow": {
    "none": "none"
  },
  "motion": {
    "duration": {
      "instant": 0,
      "short": 180
    },
    "easing": {
      "standard": "cubic-bezier(0.22, 0.61, 0.36, 1)"
    },
    "reduced_motion": "Use the original static SVG with a frozen clock and no animation frame or clock timer. Choices redraw a static SVG only when requested."
  },
  "layout": {
    "content_max_width": "82rem",
    "text_max_width": "36ch",
    "breakpoints": {
      "tablet": 768,
      "desktop": 1024
    }
  },
  "contrast_pairs": [
    {
      "foreground": "text",
      "background": "background",
      "purpose": "Primary text on deep black",
      "minimum_ratio": 4.5
    },
    {
      "foreground": "muted",
      "background": "background",
      "purpose": "Small captions on black",
      "minimum_ratio": 4.5
    },
    {
      "foreground": "accent",
      "background": "background",
      "purpose": "Warm metal labels",
      "minimum_ratio": 4.5
    },
    {
      "foreground": "text",
      "background": "surface",
      "purpose": "Copy on graphite",
      "minimum_ratio": 4.5
    },
    {
      "foreground": "muted",
      "background": "surface",
      "purpose": "Secondary copy on graphite",
      "minimum_ratio": 4.5
    },
    {
      "foreground": "border",
      "background": "background",
      "purpose": "Control boundaries",
      "minimum_ratio": 3
    },
    {
      "foreground": "focus",
      "background": "background",
      "purpose": "Keyboard focus",
      "minimum_ratio": 3
    },
    {
      "foreground": "on_accent",
      "background": "accent",
      "purpose": "Dark text on warm metal",
      "minimum_ratio": 4.5
    }
  ]
}
