{
  "schema_version": 1,
  "color": {
    "background": "#f7f3ec",
    "surface": "#ede5d8",
    "text": "#1f1c19",
    "muted": "#5c554c",
    "accent": "#7a5c2e",
    "on_accent": "#fbf8f2",
    "border": "#8c8273",
    "focus": "#6a4c1f"
  },
  "typography": {
    "display": {
      "family": "Bodoni Moda",
      "fallback_stack": [
        "serif"
      ],
      "source": "local",
      "file": "assets/fonts/bodoni/BodoniModa-Display-LT.woff2",
      "asset_id": "bodoni-moda-display"
    },
    "body": {
      "family": "Alegreya Sans",
      "fallback_stack": [
        "sans-serif"
      ],
      "source": "local",
      "file": "assets/fonts/alegreya/AlegreyaSans-Regular-LT.woff2",
      "asset_id": "alegreya-sans-regular"
    },
    "size": {
      "small": "0.75rem",
      "body": "1.125rem",
      "heading": "2.75rem",
      "display": "3.5rem"
    },
    "weight": {
      "regular": 400,
      "bold": 500
    },
    "line_height": {
      "body": 1.62,
      "heading": 1.12
    },
    "letter_spacing": {
      "body": "0em",
      "heading": "-0.01em"
    },
    "language_test": "ĄČĘĖĮŠŲŪŽ ąčęėįšųūž"
  },
  "spacing": {
    "small": "0.5rem",
    "medium": "1rem",
    "large": "2.5rem",
    "section": "9rem"
  },
  "radius": {
    "none": "0",
    "pill": "999px"
  },
  "shadow": {
    "none": "none"
  },
  "motion": {
    "duration": {
      "instant": 0,
      "short": 180
    },
    "easing": {
      "standard": "cubic-bezier(0.22, 0.61, 0.36, 1)"
    },
    "reduced_motion": "Show the rendered static stone immediately; keep every control and service step working."
  },
  "layout": {
    "content_max_width": "82rem",
    "text_max_width": "36ch",
    "breakpoints": {
      "tablet": 768,
      "desktop": 1024
    }
  },
  "contrast_pairs": [
    {
      "foreground": "text",
      "background": "background",
      "purpose": "Primary text on ivory",
      "minimum_ratio": 4.5
    },
    {
      "foreground": "muted",
      "background": "background",
      "purpose": "Captions on ivory",
      "minimum_ratio": 4.5
    },
    {
      "foreground": "text",
      "background": "surface",
      "purpose": "Text on display plates",
      "minimum_ratio": 4.5
    },
    {
      "foreground": "muted",
      "background": "surface",
      "purpose": "Captions on display plates",
      "minimum_ratio": 4.5
    },
    {
      "foreground": "accent",
      "background": "background",
      "purpose": "Metal numerals and labels",
      "minimum_ratio": 4.5
    },
    {
      "foreground": "on_accent",
      "background": "text",
      "purpose": "Filled booking action",
      "minimum_ratio": 4.5
    },
    {
      "foreground": "border",
      "background": "background",
      "purpose": "Control boundaries",
      "minimum_ratio": 3
    },
    {
      "foreground": "focus",
      "background": "background",
      "purpose": "Focus ring",
      "minimum_ratio": 3
    }
  ]
}
