{
  "schema_version": 1,
  "color": {
    "background": "#0a0f1a",
    "surface": "#131b2c",
    "text": "#f1e8d8",
    "muted": "#b2aa9b",
    "accent": "#e4b36a",
    "on_accent": "#1a1208",
    "border": "#6e6a62",
    "focus": "#f0c27c",
    "drawer": "#0f1626"
  },
  "typography": {
    "display": {
      "family": "Cinzel",
      "fallback_stack": [
        "serif"
      ],
      "source": "local",
      "file": "assets/fonts/cinzel/Cinzel-Regular-LT.woff2",
      "asset_id": "cinzel-regular"
    },
    "body": {
      "family": "Figtree",
      "fallback_stack": [
        "sans-serif"
      ],
      "source": "local",
      "file": "assets/fonts/figtree/Figtree-Regular-LT.woff2",
      "asset_id": "figtree-regular"
    },
    "size": {
      "small": "0.75rem",
      "body": "1.0625rem",
      "heading": "2.5rem",
      "display": "3.5rem"
    },
    "weight": {
      "regular": 400,
      "bold": 500
    },
    "line_height": {
      "body": 1.65,
      "heading": 1.18
    },
    "letter_spacing": {
      "body": "0em",
      "heading": "0.08em"
    },
    "language_test": "ĄČĘĖĮŠŲŪŽ ąčęėįšųūž"
  },
  "spacing": {
    "small": "0.5rem",
    "medium": "1rem",
    "large": "2.5rem",
    "section": "8rem"
  },
  "radius": {
    "none": "0",
    "pill": "999px"
  },
  "shadow": {
    "none": "none"
  },
  "motion": {
    "duration": {
      "instant": 0,
      "short": 200,
      "drawer": 420
    },
    "easing": {
      "standard": "cubic-bezier(0.2, 0.7, 0.2, 1)"
    },
    "reduced_motion": "Show the lit photograph at once and open the drawer without sliding; every booking step still works."
  },
  "layout": {
    "content_max_width": "84rem",
    "text_max_width": "38ch",
    "breakpoints": {
      "tablet": 768,
      "desktop": 1024
    }
  },
  "contrast_pairs": [
    {
      "foreground": "text",
      "background": "background",
      "purpose": "Cream text on night",
      "minimum_ratio": 4.5
    },
    {
      "foreground": "muted",
      "background": "background",
      "purpose": "Captions on night",
      "minimum_ratio": 4.5
    },
    {
      "foreground": "text",
      "background": "surface",
      "purpose": "Text on navy panels",
      "minimum_ratio": 4.5
    },
    {
      "foreground": "muted",
      "background": "surface",
      "purpose": "Captions on navy panels",
      "minimum_ratio": 4.5
    },
    {
      "foreground": "accent",
      "background": "background",
      "purpose": "Lamp-light labels and prices",
      "minimum_ratio": 4.5
    },
    {
      "foreground": "on_accent",
      "background": "accent",
      "purpose": "Filled confirm action",
      "minimum_ratio": 4.5
    },
    {
      "foreground": "text",
      "background": "drawer",
      "purpose": "Drawer text",
      "minimum_ratio": 4.5
    },
    {
      "foreground": "border",
      "background": "background",
      "purpose": "Control boundaries",
      "minimum_ratio": 3
    },
    {
      "foreground": "focus",
      "background": "background",
      "purpose": "Focus ring",
      "minimum_ratio": 3
    }
  ]
}
