{
  "schema_version": 1,
  "color": {
    "background": "#f4efe4",
    "surface": "#e8e1d2",
    "text": "#26352c",
    "muted": "#555c4f",
    "accent": "#1f3a2f",
    "on_accent": "#faf6ed",
    "border": "#837b68",
    "focus": "#8a4a31",
    "brown": "#63402b",
    "wine": "#762c3e",
    "paper": "#faf6ed",
    "leather": "#c4a27b",
    "seam": "#725b42",
    "error": "#922c26"
  },
  "typography": {
    "display": {
      "family": "Newsreader",
      "fallback_stack": [
        "serif"
      ],
      "source": "local",
      "file": "assets/fonts/newsreader/Newsreader-Regular-LT.woff2",
      "asset_id": "newsreader"
    },
    "body": {
      "family": "Jost",
      "fallback_stack": [
        "sans-serif"
      ],
      "source": "local",
      "file": "assets/fonts/jost/Jost-Regular-LT.woff2",
      "asset_id": "jost"
    },
    "size": {
      "small": "0.75rem",
      "body": "1.0625rem",
      "heading": "2.5rem",
      "display": "3.5rem"
    },
    "weight": {
      "regular": 400,
      "bold": 400
    },
    "line_height": {
      "body": 1.65,
      "heading": 1.08
    },
    "letter_spacing": {
      "body": "0em",
      "heading": "-0.02em"
    },
    "language_test": "ĄČĘĖĮŠŲŪŽ ąčęėįšųūž"
  },
  "spacing": {
    "small": "0.5rem",
    "medium": "1rem",
    "large": "2.5rem",
    "section": "8rem"
  },
  "radius": {
    "none": "0",
    "pill": "999px"
  },
  "shadow": {
    "none": "none"
  },
  "motion": {
    "duration": {
      "instant": 0,
      "short": 200,
      "drawer": 420
    },
    "easing": {
      "standard": "cubic-bezier(0.2, 0.7, 0.2, 1)"
    },
    "reduced_motion": "The monogram and archive object appear in their final state; scrolling and user choices update the ledger immediately without animation."
  },
  "layout": {
    "content_max_width": "84rem",
    "text_max_width": "38ch",
    "breakpoints": {
      "tablet": 768,
      "desktop": 1024
    }
  },
  "contrast_pairs": [
    {
      "foreground": "text",
      "background": "background",
      "purpose": "Main ink",
      "minimum_ratio": 4.5
    },
    {
      "foreground": "muted",
      "background": "background",
      "purpose": "Captions",
      "minimum_ratio": 4.5
    },
    {
      "foreground": "text",
      "background": "surface",
      "purpose": "Worktable text",
      "minimum_ratio": 4.5
    },
    {
      "foreground": "on_accent",
      "background": "accent",
      "purpose": "Selected choices and dark closing",
      "minimum_ratio": 4.5
    },
    {
      "foreground": "brown",
      "background": "background",
      "purpose": "Archive labels",
      "minimum_ratio": 4.5
    },
    {
      "foreground": "wine",
      "background": "background",
      "purpose": "Thread option",
      "minimum_ratio": 4.5
    },
    {
      "foreground": "border",
      "background": "background",
      "purpose": "Control boundaries",
      "minimum_ratio": 3
    },
    {
      "foreground": "focus",
      "background": "background",
      "purpose": "Visible focus",
      "minimum_ratio": 3
    },
    {
      "foreground": "error",
      "background": "background",
      "purpose": "Form errors",
      "minimum_ratio": 4.5
    },
    {
      "foreground": "accent",
      "background": "leather",
      "purpose": "Large initial glyphs on folio",
      "minimum_ratio": 3
    },
    {
      "foreground": "brown",
      "background": "leather",
      "purpose": "Large initial glyphs on folio",
      "minimum_ratio": 3
    },
    {
      "foreground": "wine",
      "background": "leather",
      "purpose": "Large initial glyphs on folio",
      "minimum_ratio": 3
    }
  ]
}
