{
  "schema_version": 1,
  "color": {
    "background": "#f1eadb",
    "surface": "#e0d6c3",
    "text": "#202020",
    "muted": "#5f584f",
    "accent": "#b93122",
    "on_accent": "#fff9ef",
    "border": "#746c60",
    "focus": "#134d80",
    "blue": "#184a88",
    "on_blue": "#f8f1e5",
    "yellow": "#e4b52d"
  },
  "typography": {
    "display": {
      "family": "Arial",
      "fallback_stack": [
        "sans-serif"
      ],
      "source": "system"
    },
    "body": {
      "family": "Arial",
      "fallback_stack": [
        "sans-serif"
      ],
      "source": "system"
    },
    "size": {
      "small": "0.875rem",
      "body": "1rem",
      "heading": "2rem",
      "display": "4rem"
    },
    "weight": {
      "regular": 400,
      "bold": 700
    },
    "line_height": {
      "body": 1.6,
      "heading": 1.1
    },
    "letter_spacing": {
      "body": "0em",
      "heading": "-0.02em"
    },
    "language_test": "\u0104\u010c\u0118\u0116\u012e\u0160\u0172\u016a\u017d \u0105\u010d\u0119\u0117\u012f\u0161\u0173\u016b\u017e"
  },
  "spacing": {
    "small": "0.5rem",
    "medium": "1rem",
    "large": "2rem",
    "section": "4rem"
  },
  "radius": {
    "none": "0",
    "small": "0.25rem"
  },
  "shadow": {
    "none": "none"
  },
  "motion": {
    "duration": {
      "instant": 0,
      "short": 150
    },
    "easing": {
      "standard": "ease-out"
    },
    "reduced_motion": "Remove nonessential transforms and transitions; keep all content visible."
  },
  "layout": {
    "content_max_width": "75rem",
    "text_max_width": "65ch",
    "breakpoints": {
      "tablet": 768,
      "desktop": 1024
    }
  },
  "contrast_pairs": [
    {
      "foreground": "text",
      "background": "background",
      "purpose": "Page text",
      "minimum_ratio": 4.5
    },
    {
      "foreground": "text",
      "background": "surface",
      "purpose": "Surface text",
      "minimum_ratio": 4.5
    },
    {
      "foreground": "muted",
      "background": "background",
      "purpose": "Secondary text",
      "minimum_ratio": 4.5
    },
    {
      "foreground": "on_accent",
      "background": "accent",
      "purpose": "Accent labels",
      "minimum_ratio": 4.5
    },
    {
      "foreground": "focus",
      "background": "background",
      "purpose": "Keyboard focus",
      "minimum_ratio": 3
    },
    {
      "foreground": "on_blue",
      "background": "blue",
      "purpose": "Statement text",
      "minimum_ratio": 4.5
    },
    {
      "foreground": "text",
      "background": "yellow",
      "purpose": "Yellow field labels",
      "minimum_ratio": 4.5
    },
    {
      "foreground": "yellow",
      "background": "blue",
      "purpose": "Large statement emphasis",
      "minimum_ratio": 3
    }
  ]
}
