{
  "schema_version": 1,
  "color": {
    "background": "#f3eee7",
    "surface": "#e7e5da",
    "text": "#322f25",
    "muted": "#5a5749",
    "accent": "#49543a",
    "on_accent": "#faf7f1",
    "border": "#868472",
    "focus": "#8a402a",
    "day": "#f0e5d4",
    "evening": "#e9d4c4",
    "light": "#faf7f1",
    "ink": "#18231d",
    "error": "#8c2d21"
  },
  "typography": {
    "display": {
      "family": "Newsreader",
      "fallback_stack": [
        "serif"
      ],
      "source": "local",
      "file": "assets/fonts/newsreader/Newsreader-Regular-LT.woff2",
      "asset_id": "newsreader"
    },
    "body": {
      "family": "Figtree",
      "fallback_stack": [
        "sans-serif"
      ],
      "source": "local",
      "file": "assets/fonts/figtree/Figtree-Regular-LT.woff2",
      "asset_id": "figtree"
    },
    "size": {
      "small": "0.75rem",
      "body": "1.0625rem",
      "heading": "2.5rem",
      "display": "3.5rem"
    },
    "weight": {
      "regular": 400,
      "bold": 400
    },
    "line_height": {
      "body": 1.65,
      "heading": 1.08
    },
    "letter_spacing": {
      "body": "0em",
      "heading": "-0.025em"
    },
    "language_test": "ĄČĘĖĮŠŲŪŽ ąčęėįšųūž"
  },
  "spacing": {
    "small": "0.5rem",
    "medium": "1rem",
    "large": "2.5rem",
    "section": "8rem"
  },
  "radius": {
    "none": "0",
    "pill": "999px"
  },
  "shadow": {
    "none": "none"
  },
  "motion": {
    "duration": {
      "instant": 0,
      "short": 200,
      "drawer": 420
    },
    "easing": {
      "standard": "cubic-bezier(0.2, 0.7, 0.2, 1)"
    },
    "reduced_motion": "Show the final landscape without zoom; day choices immediately change photograph and page light."
  },
  "layout": {
    "content_max_width": "84rem",
    "text_max_width": "38ch",
    "breakpoints": {
      "tablet": 768,
      "desktop": 1024
    }
  },
  "contrast_pairs": [
    {
      "foreground": "text",
      "background": "background",
      "purpose": "Main text",
      "minimum_ratio": 4.5
    },
    {
      "foreground": "muted",
      "background": "background",
      "purpose": "Secondary text",
      "minimum_ratio": 4.5
    },
    {
      "foreground": "text",
      "background": "surface",
      "purpose": "Ritual panel text",
      "minimum_ratio": 4.5
    },
    {
      "foreground": "accent",
      "background": "background",
      "purpose": "Labels",
      "minimum_ratio": 4.5
    },
    {
      "foreground": "light",
      "background": "accent",
      "purpose": "Selected ritual and submit",
      "minimum_ratio": 4.5
    },
    {
      "foreground": "text",
      "background": "day",
      "purpose": "Daylight text",
      "minimum_ratio": 4.5
    },
    {
      "foreground": "text",
      "background": "evening",
      "purpose": "Dusk text",
      "minimum_ratio": 4.5
    },
    {
      "foreground": "border",
      "background": "background",
      "purpose": "Input boundaries",
      "minimum_ratio": 3
    },
    {
      "foreground": "focus",
      "background": "background",
      "purpose": "Keyboard focus",
      "minimum_ratio": 3
    },
    {
      "foreground": "light",
      "background": "ink",
      "purpose": "Hero text and pause",
      "minimum_ratio": 4.5
    },
    {
      "foreground": "error",
      "background": "background",
      "purpose": "Error text",
      "minimum_ratio": 4.5
    }
  ]
}
